{
  "id": "person-001",
  "resourceType": "Person",
  "identifier": [
    { "system": "http://hospital.example.org/mrn", "value": "A123456" }
  ],
  "name": [
    { "use": "official", "family": "Zhang", "given": ["San"] }
  ],
  "birthDate": "1990-05-12",
  "gender": "male",
  "telecom": [
    { "system": "phone", "value": "+1-555-0100", "use": "mobile" }
  ],
  "address": [
    { "line": ["123 Health St"], "city": "San Jose", "state": "CA", "postalCode": "95112", "country": "US" }
  ],
  "clinicalSummary": {
    "conditions": [
      {
        "coding": [
          { "system": "http://snomed.info/sct", "code": "44054006", "display": "Diabetes mellitus type 2" }
        ],
        "text": "2 型糖尿病"
      }
    ],
    "bloodType": "O+",
    "primaryCareProvider": "prov-789"
  }
}
